{
  "id": "thomas-store",
  "manufacturerId": "thomas-texas",
  "mode": "external-cart",
  "supportsMultipleItems": true,
  "supportsQuantities": true,
  "supportedPaymentMethods": ["card", "usdc", "invoice"],
  "merchantOfRecordName": "Javelina Propeller Laboratory LLC",
  "immediatePayment": true,
  "notes": "JPL self-serve checkout. Until the online payment link is live, JPL sends a Stripe invoice (card payment) with each order confirmation."
}
